{
  "schema_version": "1.0.0",
  "request_id": "req-0002",
  "caller": "c1-orchestrator",
  "query_text": "What personal relief applied on 1 June 2021?",
  "as_of_date": "2021-06-01",
  "taxpayer_category": "resident_individual",
  "rule_types": [
    "relief"
  ],
  "top_k": 3,
  "include_history": true
}
